{
  "schema_version": 1,
  "property_id": "FURAMA_DANANG",
  "languages": [
    "en",
    "ko",
    "vi",
    "zh"
  ],
  "source_files": {
    "entities.jsonl": "370f28001ffc4235e07fd47f9ee3f4de75135322bb17bb3c85ac2289b93b0bd0",
    "aliases.json": "68bd1862eceb10a06f46f38a1f07a7db700dbe7cfd012e49f2d437db3aa0eb54",
    "service_catalog.json": "f31554708753a9cfd640a6f9c47b6ffb5a3067005c35cd0c27dc3025be5d2af7"
  },
  "entities": [
    {
      "id": "bar.hai_van_lounge",
      "category": "dining",
      "names": {
        "en": [
          "hải vân lounge"
        ],
        "ko": [
          "하이반 라운지",
          "hải vân lounge"
        ],
        "vi": [
          "hải vân lounge"
        ],
        "zh": [
          "海云酒廊",
          "hải vân lounge"
        ]
      },
      "aliases": {
        "en": [
          "hải vân lounge"
        ],
        "ko": [
          "하이반 라운지"
        ],
        "vi": [
          "hải vân lounge"
        ],
        "zh": [
          "海云酒廊"
        ]
      }
    },
    {
      "id": "bar.lagoon_bar",
      "category": "dining",
      "names": {
        "en": [
          "lagoon bar"
        ],
        "ko": [
          "라군 바",
          "lagoon bar"
        ],
        "vi": [
          "lagoon bar",
          "quầy bar lagoon"
        ],
        "zh": [
          "环礁湖酒吧",
          "lagoon bar"
        ]
      },
      "aliases": {
        "en": [
          "lagoon bar"
        ],
        "ko": [
          "라군 바"
        ],
        "vi": [
          "quầy bar lagoon"
        ],
        "zh": [
          "环礁湖酒吧"
        ]
      }
    },
    {
      "id": "bar.lamuse_gourmet_cafe",
      "category": "dining",
      "names": {
        "en": [
          "l’amuse gourmet cafe"
        ],
        "ko": [
          "라뮤즈 고메 카페",
          "l’amuse gourmet cafe"
        ],
        "vi": [
          "l’amuse gourmet cafe"
        ],
        "zh": [
          "l’amuse 精品咖啡厅",
          "l’amuse gourmet cafe"
        ]
      },
      "aliases": {
        "en": [
          "l’amuse gourmet cafe"
        ],
        "ko": [
          "라뮤즈 고메 카페"
        ],
        "vi": [
          "l’amuse gourmet cafe"
        ],
        "zh": [
          "l’amuse 精品咖啡厅"
        ]
      }
    },
    {
      "id": "bar.ocean_terrace",
      "category": "dining",
      "names": {
        "en": [
          "the ocean terrace"
        ],
        "ko": [
          "더 오션 테라스",
          "the ocean terrace"
        ],
        "vi": [
          "the ocean terrace"
        ],
        "zh": [
          "海洋露台",
          "the ocean terrace"
        ]
      },
      "aliases": {
        "en": [
          "the ocean terrace"
        ],
        "ko": [
          "더 오션 테라스"
        ],
        "vi": [
          "the ocean terrace"
        ],
        "zh": [
          "海洋露台"
        ]
      }
    },
    {
      "id": "contact.butler_service",
      "category": "contact",
      "names": {
        "en": [
          "butler service"
        ],
        "ko": [
          "버틀러 서비스",
          "butler service"
        ],
        "vi": [
          "butler service",
          "dịch vụ quản gia"
        ],
        "zh": [
          "管家服务",
          "butler service"
        ]
      },
      "aliases": {
        "en": [
          "butler",
          "villa butler",
          "butler hotline",
          "butler service",
          "private butler"
        ],
        "ko": [
          "버틀러",
          "빌라 버틀러",
          "전담 버틀러",
          "버틀러 서비스"
        ],
        "vi": [
          "quản gia",
          "dịch vụ quản gia",
          "hotline quản gia",
          "quản gia biệt thự"
        ],
        "zh": [
          "管家",
          "别墅管家",
          "私人管家",
          "管家服务"
        ]
      }
    },
    {
      "id": "contact.danang_office",
      "category": "contact",
      "names": {
        "en": [
          "danang head office"
        ],
        "ko": [
          "다낭 본사",
          "danang head office"
        ],
        "vi": [
          "văn phòng đà nẵng",
          "danang head office"
        ],
        "zh": [
          "岘港办事处",
          "danang head office"
        ]
      },
      "aliases": {
        "en": [
          "danang head office"
        ],
        "ko": [
          "다낭 본사"
        ],
        "vi": [
          "văn phòng đà nẵng"
        ],
        "zh": [
          "岘港办事处"
        ]
      }
    },
    {
      "id": "contact.fb_reservation",
      "category": "contact",
      "names": {
        "en": [
          "f&b reservations"
        ],
        "ko": [
          "식음료 예약부",
          "f&b reservations"
        ],
        "vi": [
          "f&b reservations",
          "bộ phận đặt bàn ẩm thực"
        ],
        "zh": [
          "餐饮预订部",
          "f&b reservations"
        ]
      },
      "aliases": {
        "en": [
          "f&b reservations"
        ],
        "ko": [
          "식음료 예약부"
        ],
        "vi": [
          "bộ phận đặt bàn ẩm thực"
        ],
        "zh": [
          "餐饮预订部"
        ]
      }
    },
    {
      "id": "contact.medical_centre",
      "category": "contact",
      "names": {
        "en": [
          "resort medical centre"
        ],
        "ko": [
          "의료 센터 연락처",
          "resort medical centre"
        ],
        "vi": [
          "resort medical centre",
          "liên hệ trung tâm y tế resort"
        ],
        "zh": [
          "医疗中心联系方式",
          "resort medical centre"
        ]
      },
      "aliases": {
        "en": [
          "sick",
          "nurse",
          "clinic",
          "doctor",
          "emergency",
          "first aid",
          "medical center",
          "resort medical centre"
        ],
        "ko": [
          "약",
          "구급",
          "의사",
          "간호사",
          "응급 처치",
          "의료 센터 연락"
        ],
        "vi": [
          "y tá",
          "thuốc",
          "bác sĩ",
          "cấp cứu",
          "phòng y tế",
          "sơ cấp cứu",
          "trung tâm y tế resort",
          "liên hệ trung tâm y tế"
        ],
        "zh": [
          "医生",
          "急救",
          "护士",
          "生病",
          "医务室",
          "联系医疗中心"
        ]
      }
    },
    {
      "id": "contact.reservation",
      "category": "contact",
      "names": {
        "en": [
          "room reservations"
        ],
        "ko": [
          "객실 예약부",
          "room reservations"
        ],
        "vi": [
          "bộ phận đặt phòng",
          "room reservations"
        ],
        "zh": [
          "客房预订部",
          "room reservations"
        ]
      },
      "aliases": {
        "en": [
          "room reservations"
        ],
        "ko": [
          "객실 예약부"
        ],
        "vi": [
          "bộ phận đặt phòng"
        ],
        "zh": [
          "客房预订部"
        ]
      }
    },
    {
      "id": "contact.sales_hanoi",
      "category": "contact",
      "names": {
        "en": [
          "hanoi sales office"
        ],
        "ko": [
          "하노이 영업소",
          "hanoi sales office"
        ],
        "vi": [
          "hanoi sales office",
          "văn phòng bán hàng hà nội"
        ],
        "zh": [
          "河内销售处",
          "hanoi sales office"
        ]
      },
      "aliases": {
        "en": [
          "hanoi sales office"
        ],
        "ko": [
          "하노이 영업소"
        ],
        "vi": [
          "văn phòng bán hàng hà nội"
        ],
        "zh": [
          "河内销售处"
        ]
      }
    },
    {
      "id": "contact.sales_hcm",
      "category": "contact",
      "names": {
        "en": [
          "ho chi minh city sales office"
        ],
        "ko": [
          "호치민 영업소",
          "ho chi minh city sales office"
        ],
        "vi": [
          "văn phòng bán hàng tp.hcm",
          "ho chi minh city sales office"
        ],
        "zh": [
          "胡志明市销售处",
          "ho chi minh city sales office"
        ]
      },
      "aliases": {
        "en": [
          "ho chi minh city sales office"
        ],
        "ko": [
          "호치민 영업소"
        ],
        "vi": [
          "văn phòng bán hàng tp.hcm"
        ],
        "zh": [
          "胡志明市销售处"
        ]
      }
    },
    {
      "id": "dining.restaurant_reservation",
      "category": "dining",
      "names": {
        "en": [
          "restaurant & bar reservation"
        ],
        "ko": [
          "레스토랑 및 바 예약",
          "restaurant & bar reservation"
        ],
        "vi": [
          "đặt bàn nhà hàng & bar",
          "restaurant & bar reservation"
        ],
        "zh": [
          "餐厅及酒吧预订",
          "restaurant & bar reservation"
        ]
      },
      "aliases": {
        "en": [
          "book a table",
          "reserve a table",
          "restaurant booking",
          "restaurant & bar reservation"
        ],
        "ko": [
          "식당 예약",
          "자리 예약",
          "테이블 예약",
          "레스토랑 및 바 예약"
        ],
        "vi": [
          "giữ bàn",
          "đặt bàn",
          "book bàn",
          "đặt bàn ăn",
          "đặt chỗ nhà hàng",
          "đặt bàn nhà hàng & bar"
        ],
        "zh": [
          "订桌",
          "订餐厅",
          "预留餐桌",
          "餐厅及酒吧预订"
        ]
      }
    },
    {
      "id": "golf.ba_na_hills_golf_club",
      "category": "recreation",
      "names": {
        "en": [
          "ba na hills golf club"
        ],
        "ko": [
          "ba na hills golf club"
        ],
        "vi": [
          "ba na hills golf club"
        ],
        "zh": [
          "ba na hills golf club"
        ]
      },
      "aliases": {
        "en": [
          "ba na hills golf club"
        ],
        "ko": [
          "ba na hills golf club"
        ],
        "vi": [
          "ba na hills golf club"
        ],
        "zh": [
          "ba na hills golf club"
        ]
      }
    },
    {
      "id": "golf.danang_golf_club",
      "category": "recreation",
      "names": {
        "en": [
          "danang golf club"
        ],